{
  "after_subject_fingerprint": "sha256:0000000000000000000000000000000000000000000000000000000000000000",
  "after_validation_ref": "fixture",
  "before_failure_ref": "fixture",
  "evidence_refs": [
    "fixture"
  ],
  "family_fingerprint": "sha256:0000000000000000000000000000000000000000000000000000000000000000",
  "record_fingerprint": "sha256:0000000000000000000000000000000000000000000000000000000000000000",
  "recurrence_failure_refs": [
    "fixture"
  ],
  "regression_record_id": "fixture",
  "schema_id": "star.regression-record",
  "schema_version": 1,
  "state": "fixed",
  "verification_state": "verified"
}